Title,Price (INR),Description,Carpet Area,Super Area,Transaction,Furnishing,Bathroom,Possession,Car Parking,Price per Sqft,Society
"3 BHK Apartment for Sale in Tellapur, Outer Ring Road Hyderabad",1.19 Cr,"Premium 2  3 BHK luxury apartments starting from 92 Lakhs in a 5.27acre thoughtfully designed gated community. Project Highlights Total Area 5.27 Acres  Thoughtfully designed community Total Units 567 Premium Homes across 6 Blocks Structure Cellar  Stilt  9 Floors Access 60Feet Wide Front Road for smooth connectivity Configuration  Availability 2 BHK  1350 Sq. Ft. 3 BHK  1750, 1755  1825 Sq. Ft. Project USP 60Feet Wide Front Road  Smooth Connectivity 25,000 Sq. Ft. Clubhouse  30 Modern Amenities 100 Vastu Compliant  24x7 Security  Low Density.",,1755 sqft,New Property,Unfurnished,3,Poss. by Dec '25,2 Covered,6800 per sqft,
2 BHK Apartment for Sale in Gachibowli Hyderabad,1.30 Cr,"Two bedroom available for sale, My Home Vihanga at financial district,1115 square feet flat, with one car parking, west facing available, fourth floor, undivided share of land 31 Sq Yds",,1115 sqft,Resale,Semi-Furnished,2,,1 Covered,11659 per sqft,My Home Vihanga
3 BHK Apartment for Sale in SP Nagar Moula Ali Hyderabad,1 Cr,3bhk premium flat for sale at ECIL. Near SP Nagar. Excellent location and connectivity.Surrounded by communities schools and malls,,1900 sqft,New Property,Unfurnished,3,Poss. by Oct '25,1 Covered,5300 per sqft,
2 BHK Apartment for Sale in Nanakaramguda Hyderabad,1.41 Cr,,,1574 sqft,New Property,Unfurnished,2,,,8958 per sqft,Empire Urbana
3 BHK Apartment for Sale in Shamshabad Hyderabad,1.34 Cr,,,1681 sqft,New Property,Unfurnished,2,Poss. by Feb '28,1 Covered,7993 per sqft,
2 BHK Apartment for Sale in Nalagandla Hyderabad,1.20 Cr,"Walk through this warm 2 BHK flat available for sale in the prestigious locality of Nallagandla, Hyderabad. With Vaastu compliance in mind, this home ensures a peaceful and harmonious living space. The east direction ensures there is always light and warmth throughout the day. Don't wait to get this stunning flat as your new home!::::::Note: The property is under construction and will be handed over by December 2025.::::::Property Specifications::::::This large unfurnished flat provides a big super area of 1255 sq. ft. and is situated on the 6th floor of a neat building with 14 floors. The home has 2 bedrooms with attached western bathrooms each. This spacious flat benefits from two balconies, one off the living room and the other off the kitchen, both with views of the road.::::::The apartment has a separate dining and living space, allowing for sufficient area for entertainment and relaxation. The standard kitchen is equipped with a piped gas point and a utility space for extra convenience. Sleek vitrified tiles complete the flooring, giving the home an added modern touch. Moreover, this property is Vaastu compliant and east-facing, ensuring a positive living atmosphere.::::::Facilities::::::Amenities such as car parking with cover, 24-hour water connection from both corporation and borewell, and 100% power backup to ensure seamless living are provided. Security is provided by having a security guard available and CCTV cameras installed across the complex. The building also has 4 to 5 lifts for ease of movement across all floors.::::::Residents can enjoy a variety of amenities, including a kids play area, gym, swimming pool, clubhouse, and options for both indoor and outdoor games.::::::Locality ::::::Situated in a vibrant locality, this area is conveniently located near prominent landmarks such as Aparna Mall, D Mart, and Ratnadeep. Families will appreciate the proximity to various schools and hospitals nearby, ensuring essential services are within reach. Public transport is easily accessible, with buses and auto-rickshaws readily available for convenient commuting. Additionally, banks and ATMs are close by, and the Lingampally railway station is just a short distance away, enhancing connectivity to the broader region.::",,1255 sqft,Resale,Unfurnished,2,Poss. by Dec '25,,9562 per sqft,Ramky One Orbit
3 BHK Apartment for Sale in Bachupally Hyderabad,1.09 Cr,"Up for sale is a spacious and delightfully well-maintained 3 BHK apartment that is located in Urbanrise On Cloud 33, Bachupally, Hyderabad. Grab this amazing opportunity today to settle-in with your beloved family.Property SpecificationsEnjoy a well-connected lifestyle with modern conveniences in this spacious apartment that is situated on the 7th floor of a 33-story tower. Designed for practicality and comfort, this East-facing home is Vaastu-compliant, ensuring good energy flow and natural light throughout the day.With a carpet area of 931 sq. ft., this unfurnished apartment allows you to personalize the space to your taste. It has three comfortably sized bedrooms, two bathroomsone en suite and one commonequipped with geyser points. An attached balcony that is part of the living room provides an open-space, invigorating view, ideal for relaxation.The living cum dining area is well-designed to optimize space utilization, with the kitchen boasting a strong platform and sink. A piped gas connection allows for efficient cooking, with an attached utility space providing functionality. Vitrified tile flooring covers everything, providing a modern finish.FacilitiesResidents are equipped with a covered parking area to store vehicles securely. There is a 24-hour water facility through borewell and corporation water, and a 100 power backup is provided to assure uninterrupted living. Three high-speed lifts, CCTV cameras, and professional security guards are present within the building for a secure and trouble-free ambience. Furthermore, residents enjoy a clubhouse, swimming pool, and rooftop garden.LocalitySituated near Kennedy Global School and Mamata Medical College, the apartment is perfect for families. Daily needs are easily accessible, with malls and supermarkets just 46 km away and banks and ATMs nearby. Public transport in the form of buses and autos is easily available, making commuting easy. The Hi-Tech City Railway Station is just 5 km away, and the Miyapur Metro Station is a mere 4 km drive away.",931 sqft,,New Property,Unfurnished,2,,,8056 per sqft,Urbanrise On Cloud 33
3 BHK Apartment for Sale in Bachupally Hyderabad,1.30 Cr,,,1617 sqft,Resale,Unfurnished,3,,,8040 per sqft,Urbanrise On Cloud 33
2 BHK Apartment for Sale in TNGOS Colony Hyderabad,1.30 Cr,One of the biggest gated community in gachibowli.,980 sqft,,Resale,Semi-Furnished,2,,1 Covered,11659 per sqft,My Home Vihanga
2 BHK Apartment for Sale in Hitech City Hyderabad,1.40 Cr,"Spread across 22 acres and constituting 12 blocks, Rainbow Vistas is a project built by Cybercity Builders and Developers Pvt. Ltd. It is considered one of the largest gated societies near HITEC City. Apartment kinds offered by the community include luxury 2, 3 and 4BHK with floor lengths ranging from 1250 sqft to 3000 sqft. Apart from these luxury apartments, the SAPPHIRE Block of the society hosts premium 3 and 4BHK flats with a carpet area stretching around 2000 to 3000 sqft.",1250 sqft,,Resale,Semi-Furnished,2,,1 Covered,11200 per sqft,Rainbow Vistas at Rock Garden
2 BHK Apartment for Sale in Kondapur Hyderabad,1.50 Cr,"near to amb mall, botanical garden, international schools, hospitals, hotels, metro station, orr, airport, parks, etc",,1410 sqft,New Property,Unfurnished,2,,,10638 per sqft,SMR Vinay Iconia
2 BHK Apartment for Sale in Hitech City Hyderabad,1.20 Cr,"Multistory apartment is available for sale. It covered area of 1262 sq-ft, it is a good location. Please contact for more details.",1121 sqft,,Resale,Unfurnished,2,,,9509 per sqft,Mahindra Ashvita
4 BHK  House for Sale in Beeramguda Main Road Hyderabad,1.30 Cr,red brick construction and quality construction,2400 sqft,,New Property,Semi-Furnished,5,,,5417 per sqft,
3 BHK Apartment for Sale in Gachibowli Hyderabad,1.50 Cr,"Beautiful, spacious apartment in a well maintained gated community, is available for Sale. The property is right next to Hyderabad fastest growing IT hubs . All necessary amenities like club house, swimming pool, jogging track, power backup, children park area, etc., are available inside the housing society. It is very secure, peaceful and beautiful society. The flat is semi furnished with tube lights, fan, Geyser and wardrobes. Contact us to arrange view.",,1733 sqft,Resale,Unfurnished,3,,2 Covered,8656 per sqft,Manjeera Diamond Towers
2 BHK Apartment for Sale in Chanda Nagar Hyderabad,1.20 Cr,West facing with semi furnished  Modular kitchen with Good wardrobes  2 balcony. 1 car parking with geysers.,1295 sqft,,Resale,Semi-Furnished,2,,,9266 per sqft,Aparna HillPark Lake Breeze
"3 BHK Apartment for Sale in Habsiguda, NH 2 2 Hyderabad",1.43 Cr,,,1870 sqft,New Property,Unfurnished,3,Poss. by Oct '29,,7647 per sqft,
Plot/Land for Sale in Mokila Hyderabad,1.20 Cr,"1. Security and SafetyControlled access Entry and exit are usually monitored by security personnel andor surveillance systems.Fenced perimeters Reduces risks of theft, trespassing, or unwanted visitors.CCTV monitoring Many communities have 247 surveillance cameras. 2. Planned InfrastructurePaved roads, street lighting, and drainage systems are usually professionally designed.Utilities Power, water, and sometimes gas lines are preinstalled or easier to connect.Rainwater harvesting or STP Sewage Treatment Plants in modern layouts. 3. Lifestyle and AmenitiesClubhouse, gy",,,New Property,,,,,6667 per sqft,Aparna Western Meadows
Plot/Land for Sale in Mokila Hyderabad,1 Cr,"INDUS SCHOOLNAGULAPALLY RAIL TERMINAL ICFAI COLLEGE 33,30 all block top roadsUnder ground drainage..Avenue plontationOver head water tankPark with landscapingEntair vanture facing with entrance archModren modular street lights247 security faciliteWater harvasting pitsEclectrical lines and water lines on all roadesEvery 15mins city bus frequentPlotsland available residential and commercial",,,Resale,,,,,5556 per sqft,Green City Gachibowli County
3 BHK Apartment for Sale in Hyderguda Hyderabad,1 Cr,"3 Bedroom, 2 Full Bath with 3 balconies. Vacant and ready for occupation.",,1100 sqft,Resale,,,,,9091 per sqft,RKS Apartments
2 BHK Apartment for Sale in Puppalguda Hyderabad,1.50 Cr,"Corner flat west facing , ready to move in Phase 1. Aparna Zenon. investor resale unit.",,1326 sqft,Resale,Unfurnished,2,,,11312 per sqft,Aparna Zenon
3 BHK Apartment for Sale in Mallapur Hyderabad,1.10 Cr,"Gated community with all facilities nearby, prominent location in Mallapur, friendly family oriented community celebrating various religious and cultural activities, active committee members constantly looking at improving society.  Near Ratnadeep, PVR Multiplex, 5 Mins away Metro towards Hitech city, 20 mins to Secunderabad station, Johnson Grammar and Delhi Public Schools are nearby",,1625 sqft,Resale,Semi-Furnished,2,,,6769 per sqft,Modi Mayflower Grande
3 BHK Apartment for Sale in Nalagandla Hyderabad,1.40 Cr,This location is close to Hyderabads IT Hub and several major international schools.,1435 sqft,,Resale,Semi-Furnished,2,,1 Covered,,Aparna CyberZon
3 BHK Apartment for Sale in Neknampur Hyderabad,1.30 Cr,New 3 bhk semi furnished flatGYm2 Car parkingpower backupCommunity hall,1200 sqft,,Resale,Semi-Furnished,3,,2 Covered,9123 per sqft,
Plot/Land for Sale in Mokila Hyderabad,1.11 Cr,"HMDA Mega Gated Township Alround Compound wall Electricity with LED Strt Lights Club House Swimming pool Community Hall Master plan 100  road facing venture Residential Zone  R1  100  , 80  , 40  33   30  All CC Roads  100   80  Center Divider Grand Entrance Arch Avenue Plantation with Tree guards Rainwater Harvesting Pits Over Head Water Tank  Water Connection each plot Children Park and Cycle Track Underground Drainage Social Infrastructure Vaastu Complient Clear Title Bank Loan Available 247 Security We will undertake villa constructions also puts forth a new",,,New Property,,,,,4111 per sqft,
"2 BHK Apartment for Sale in Financial District, Nanakram Guda Hyderabad",1.16 Cr,,1100 sqft,,Resale,Semi-Furnished,2,Poss. by Oct '25,,10545 per sqft,Pacifica Hillcrest
3 BHK Apartment for Sale in Lingampally Serilingampalle Hyderabad,1.10 Cr,"This 3 bhk apartment is available for sale in pruthvi raintree abode, one of the most prominent projects for flats in rail vihar, hyderabad. This property faces the East direction. The flat is over 1438 sq.Ft. Super built up area and comes with 3 bedrooms, 2 bathrooms and 1 balcony.This flat lies on the 3rd level of a 8 storey building. This is a ready to move project and the property is 5-10 years old. The flat comes well built with marble flooring options. The flat will offer a modern lifestyle as it is presented with many of the amenities such as swimming pool, fitness centre  gym, club",,1438 sqft,Resale,Unfurnished,2,,,7650 per sqft,Raintree Abode
2 BHK Apartment for Sale in Puppalguda Hyderabad,1.28 Cr,,,1395 sqft,New Property,Unfurnished,2,,,9176 per sqft,
"Shop for Sale in Narsingi, Outer Ring Road Hyderabad",1.25 Cr,"Shops Available in ground floor and upper floor with monthly rental income starting from day one size is from 1,000 to 10,000 sft in KOMPALLY, KOKAPET, BANJARA HILLS ROAD NO12, MLA COLONY, SHAKEPET, SANIKPURI, AS RAO NAGAR, NAGOLE, MADINAGUDA MIYAPUR BHEL, ATTAPUR and Many more...",1040 sqft,,New Property,,,Poss. by May '28,"10 Covered,",12019 per sqft,
2 BHK Apartment for Sale in Gopanpalle Hyderabad,1.29 Cr,"2 BHK Flat for SALE at Honer Aquantis, Gopanpally",1280 sqft,,Resale,Unfurnished,2,,1 Covered,9556 per sqft,Honer Aquantis
"3 BHK Apartment for Sale in Miyapur, NH 9 Hyderabad",1.02 Cr,"Strategically located in Hyderabads rapidly growing residential hub, Miyapur, The World Of Joy is an iconic community that redefines living amidst natural delights with lakeside views",1100 sqft,,New Property,Unfurnished,2,Poss. by Dec '26,1 Covered,7677 per sqft,Urbanrise The World Of Joy
"3 BHK Apartment for Sale in Kukatpally, NH 9 Hyderabad",1.27 Cr,"Discover an exceptional opportunity to own a stunning apartment in the vibrant locality of Kukatpally, Hyderabad.Located in the prestigious Vasavi Sarovar project, this spacious 3bedroom, 3bathroom apartment offers a generous area of 1,875 square feet, perfect for families seeking comfort and style.Priced attractively at 1.24 crore, this unfurnished gem allows you to personalize your living space according to your taste and lifestyle.Perched on the 19th floor of a modern 31story building, the apartment boasts a captivating garden view, ensuring a serene and tranquil atmosphere.",1860 sqft,,New Property,Unfurnished,3,Poss. by Dec '26,2 Covered,6824 per sqft,Vasavi Sarovar
"3 BHK Apartment for Sale in Moosapet, NH 9 Hyderabad",1.10 Cr,North facing.24hours power backup and water facility available.,,1975 sqft,New Property,Semi-Furnished,3,Poss. by Dec '26,,5570 per sqft,Vasavi Sarovar
2 BHK Apartment for Sale in Nanakaramguda Hyderabad,1.30 Cr,"2 bhk fully furnished flat availbale for sale at golf view apartments nanaklramguda gachiboiwli, proper gated society with all amenities, good wood work done, no connectivity problem,",1200 sqft,,Resale,Furnished,2,,1 Covered,10039 per sqft,Theme Golf View
"2 BHK Apartment for Sale in Tellapur, Outer Ring Road Hyderabad",1.45 Cr,Gated community brand new high rise flat with all modern amenities,,1355 sqft,Resale,Unfurnished,2,,1 Covered,10701 per sqft,My Home Sayuk
2 BHK Apartment for Sale in Gachibowli Hyderabad,1.49 Cr,,,1350 sqft,Resale,Semi-Furnished,2,,,11037 per sqft,Rajapushpa Atria
"2 BHK Apartment for Sale in Tellapur, Outer Ring Road Hyderabad",1.28 Cr,,,1253 sqft,Resale,Unfurnished,2,,,10215 per sqft,My Home Tridasa
"Plot/Land for Sale in Pocharam, NH 2 2 Hyderabad",1 Cr,Prime Plot is in gated community and offers an immediate construction. The surrounding area is developing very fast and many gated homes are also getting ready. Ghatkesar town is 5 mins from Infosys campus. Call now.,,,Resale,,,,,2849 per sqft,
Office Space for Sale in Malkajgiri Hyderabad,1.04 Cr,,,807 sqft,New Property,,,,,12887 per sqft,
3 BHK Apartment for Sale in Pedda Amberpet Hyderabad,1 Cr,,1140 sqft,,Resale,Semi-Furnished,3,,,7042 per sqft,
2 BHK Apartment for Sale in Puppalguda Hyderabad,1.25 Cr,,,1315 sqft,New Property,Unfurnished,2,Poss. by Dec '25,,9506 per sqft,Sukhii Ubuntu
3 BHK Apartment for Sale in Gopanpalle Hyderabad,1.45 Cr,Excellent Gated Community and All facilities Available. Flat is Excellent Ventilation. Low Density  High UDS. Community Near by Q City  Wipro Circle. Near by community So many National  International School.,,1570 sqft,Resale,Semi-Furnished,2,,2 Covered,9236 per sqft,Honer Vivantis
3 BHK Apartment for Sale in Appa Junction Area Hyderabad,1.15 Cr,property available in a prime location,,1633 sqft,Resale,Unfurnished,3,,,7042 per sqft,Shanta Sriram The Bodhivriksha
2 BHK Apartment for Sale in Puppalguda Hyderabad,1.35 Cr,"Welcome home to your newly purchased home at the elegant complex of Hallmark Silvanus, Puppalaguda, Hyderabad. This gorgeous 2 BHK flat for sale is designed to provide an optimal mix of luxurious amenities and cozy living, perfect for working professionals or family, who desire a peaceful life.Property SpecificationsSpans a spacious super area of 1359 sqft, this flat is on the 3rd floor of a well-designed 5-story building. The flat is partially furnished with basic furniture like wardrobes, lights, and fans, giving a ready-to-move experience. Vaastu-friendly and East-facing, the house provides a good flow of energy and plenty of natural light.The design consists of two bathrooms and two bedrooms with one of the bathrooms as a common bathroom and the other as part of the master bedroom. The two bathrooms are in modern Western design and fitted with geyser fittings. Rejoice at the use of two balconies, one connected to the kitchen and the other linked to the living room, both facing the road, ideal for basking in the fresh air and scenery.The flat has a large living cum dining space, besides a puja room for your spiritual needs. The modular kitchen comes complete with a utility space for convenience. The flat has vitrified tiles flooring all over, providing it with a contemporary look. Since it is a corner property with two sides facing out, the flat receives additional light and ventilation.FacilitiesThis apartment is equipped with required amenities specific to easy living. The residents have the option of car parking in shelter and 24-hour water supply for the comfort of everyone. The complex boasts a 100 power backup facility, providing round-the-clock electricity supply.Safety comes first, with a guard on the premises and CCTVs placed around the buildings for further security. And, to make it convenient, the building has one lift that easily connects to all the levels.LocalitySituated aptly in Puppalaguda, this apartment is close to the basic amenities. Schools, hospitals, and mallssupermarkets are nearby, thereby ensuring that all the primary needs are easily accessible at ones fingertips. All the public means of transport are conveniently available, so daily travelling around Hyderabad becomes easy and convenient. Banks and ATMs are also very easily accessible, adding to the convenience of the location.",1300 sqft,,Resale,Semi-Furnished,2,,,9934 per sqft,
3 BHK Villa for Sale in Chitkul Hyderabad,1.29 Cr,Very Good Investment Opportunity  chitkul Muttangi ORR Exit no 3Premium Villas Hyderabad at Chitkul  ORR Exit 3Total 78acers integrated township in Phase1   Number of villas  1100 villasVilla Specifications 167 sqyds LandWith 2000sft Builtup area3BHK DUPLEX VILLAS200 sq yards Land with 2600 sft Builtup area Duplex Premium VillasHMDA PROJECT Possession 2026  December and 6months grace period Launching price  6200 Note  Premiums extra Location Highlights5 Minutes Drive to ORR 2.8 KM,1800 sqft,,New Property,Unfurnished,3,Poss. by Jun '26,"1 Covered,",6450 per sqft,
"3 BHK Apartment for Sale in Alkapur Township, Manikonda, Outer Ring Road Hyderabad",1.27 Cr,"BVR Orchard Apartments constructed by prime builders of Alkapur township, Manikonda. Total land area 573 Sq yards, with 3Bhks configuration. East North Facing  Total 10 units. 5 floos approved by HMDA norms maintained. 100  vaastu compliant with super eminent ventilation. sizes 1175 sq ft standard. Construction quality maintained with well organized Architects  engineers supervision.Possession by Ready To Move. All the basic amenities provided with car parking.  Bank loan facility available.",1800 sqft,,New Property,Unfurnished,3,,1 Covered,6700 per sqft,
"3 BHK Apartment for Sale in Kokapet, Outer Ring Road Hyderabad",1.40 Cr,Multistorey apartment is available for sale. It is a good location property near to Rajapushpa Provincia .Its 3BHk East facing Apartment with 1680SFT  less density society for peacifull living,1250 sqft,,Resale,Furnished,3,,2 Covered,8333 per sqft,Muppas Aaradhya
3 BHK Villa for Sale in Beeramguda Ramachandrapuram Hyderabad,1.45 Cr,"Property is present in ideal location.Nearby every facility is available including international school, hospital, supermarkets and etc.Very near to ORR EXIT, MUMBAI NATIONAL HIGHWAY.",1230 sqft,,Resale,Furnished,3,,2 Covered,7838 per sqft,Sri Mytri Villas
3 BHK Apartment for Sale in Vijayapuri Colony Tarnaka Hyderabad,1.40 Cr,"3 BHK Flat In Vijayapuri Colony, Tarnaka, Hyderabad  With a large super area of 2000 sqft, this tastefully designed house promises generous space for cozy dwelling in a well-developed and popular residential area.Property SpecificationsSituated on the 1st floor of a 5-storey building, this semi furnished house provides a cozy and convenient living space perfect for families looking for convenience, security, and excellent connectivity.The flat consists of 3 nicely proportioned bedrooms, each with a western-style attached bathroom with geysers for hot water. One of the bedrooms has a single balcony that has a view of the neighboring flat. The house also has a spacious living and dining space, a separate pooja room, a practical kitchen, and an independent utility area attached to the kitchen for extra comfort. The whole flat is completed with maintenance-free tiled flooring, and wardrobes are already installed in bedrooms.FacilitiesThe flat is equipped with basic modern facilities, such as one covered parking area, 24-hour water supply, 100 power backup, security guard services, a lift, and CCTV surveillance on the entire premises for security.LocalityStrategically placed at the back of the famous Mahakali Temple, this property has great access to major amenities. All major services are at walking distance, ranging from good schools, hospitals, malls, supermarkets, banks, and ATMs. Public transport is readily accessible, with buses and autos being readily available. Apart from that, a metro station at Tarnaka and a railway station are also within a 5-minute walk, thereby facilitating a smooth and stress-free daily commute.",1900 sqft,,Resale,Semi-Furnished,3,,,7000 per sqft,
2 BHK Apartment for Sale in Gopanpalle Hyderabad,1.33 Cr,,,1430 sqft,New Property,Unfurnished,2,Poss. by Sep '28,,9345 per sqft,
3 BHK Apartment for Sale in Bagh Amberpet Hyderabad,1 Cr,"Presenting a spacious and vaastu friendly 3 BHK flat for sale in Bagh Amberpet, Hyderabad, designed carefully with an east-facing door to usher in positivity and sunshine into your life.::::::::::::Property Specifications::::::::::::The flat provides a spacious and sophisticated living area with a carpet area of 1265 sqft. On the first floor of a 5-storey building, this well-maintained flat is thoughtfully furnished with wardrobes and ceiling fans, thus making it ready for occupation.::::::::::::The flat has three good-sized rooms, one of which has an attached balcony that faces the road and a garden, with a calming view and abundance of natural light. There are two bathrooms - one attached (western) and one shared (Indian) - to suit the requirements of the family. The living and dining area is planned as a combined unit, ideal for family get-togethers and leisure. Further, the flat has a separate puja room for your religious requirements.::::::::::::The modular kitchen is contemporary and functional, with a utility area attached to it to help maintain the household work effectively. The floor of the entire flat is finished with luxurious marble, providing an air of luxury and maintenance-free service.::::::::::::Faciliteis::::::::::::The building provides open parking facilities for residents, providing ease of access for vehicle owners. You will have 24-hour water supply and 100% power backup, security guard on shift and CCTV cameras are provided across the building. The building also features a lift to ensure easy mobility to the higher floors.::::::::::::Locality::::::::::::The flat's location is a plus factor. The flat is strategically located near a popular Red Building landmark, with hospitals and schools within easy reach for access to education and medical facilities. Supermarkets and malls are within easy reach, ensuring easy daily shopping. Public transport in the form of buses and autos is available for easy commuting. Vidya Nagar Railway Station is nearby, and the metro station is 4 km away, providing very good connectivity to the other areas of Hyderabad. Banks and ATMs are nearby too for all your financial requirements.",1265 sqft,,Resale,Semi-Furnished,2,,"2 Covered,",7634 per sqft,
"3 BHK Apartment for Sale in Tellapur, Outer Ring Road Hyderabad",1.30 Cr,,,2210 sqft,Resale,Semi-Furnished,3,,,5882 per sqft,Ananda The Ozone Heights
