Title,Price (INR),Description,Carpet Area,Super Area,Transaction,Furnishing,Bathroom,Possession,Car Parking,Price per Sqft,Society
2 BHK Apartment for Sale in Telecom Nagar Gachibowli Hyderabad,1.35 Cr,"LT serene county, 2 bed room flat available for sale with wood work, club house view, ready to occupation, Gated community,  swimming pool, gym, kids play area,central park, ATM, medical store, super market , contact more details please",1000 sqft,,Resale,Semi-Furnished,2,,1 Covered,11489 per sqft,L&T Serene County
"3 BHK Apartment for Sale in Tellapur, Outer Ring Road Hyderabad",1.45 Cr,Aparna Newlands is an expansive project spanning 14 acres and featuring 8 majestic highrise towers soaring 42 floors high. With 1976 thoughtfully designed 2.5  3 BHK apartments for sale in Tellapur,,1710 sqft,New Property,Unfurnished,3,Poss. by Aug '29,1 Covered,8499 per sqft,Aparna Newlands
2 BHK Apartment for Sale in Gachibowli Hyderabad,1.50 Cr,This community is very near  IT hub and ut has lots open space inside the community with world class aminities,1200 sqft,,Resale,Unfurnished,2,,"1 Covered,",11691 per sqft,Prestige High Fields
2 BHK Apartment for Sale in Puppalguda Hyderabad,1.39 Cr,Multistorey apartment is available for sale. It is a good location property. Please contact for more details.,999 sqft,,Resale,Unfurnished,2,Poss. by Mar '26,1 Covered,10500 per sqft,Aparna Zenon
3 BHK Apartment for Sale in Chitrapuri Colony Hyderabad,1.40 Cr,"Crafted exquisitely to offer maximum comfort and luxury, this spacious 3 BHK Flat available for sale in Chitrapuri Colony, Hyderabad features well-lit interiors, premium fittings, and a smart layout that maximizes space and functionality. Property Specifications Vastu-compliant, this flat is located on the top-most floor of a premium residential complex of 12 floors and offers breathtaking main road views from every room. Ideal for families looking for a spacious, well-ventilated and naturally bright flat that promises a serene and elevated lifestyle amidst urban conveniences. Spanning an expansive carpet area of 1570 sq. ft., this northeast-facing flat is ready with 4 ACs, modern interiors, and high-quality tile flooring that has low maintenance cost. Speaking about the floor plan, there is a separate living and dining area with a dining table and a cozy sofa. There are also 3 bedrooms furnished with fancy wardrobes and comfortable beds. Furthermore, there are two western bathrooms with geysers in both, and a stylish shower glass partition in one, adding a touch of luxury. One bathroom is attached to the bedroom and the other is available for common use. A dedicated pooja room adds a spiritual touch to the home, making it an ideal sanctuary for peaceful living. Moreover, there are 2 balconies, one attached to a bedroom and the other to the hall, providing spectacular views of the bustling main road, allowing residents to soak in the vibrant energy of the city. The modular kitchen, fitted with a chimney, a granite platform, and a stainless steel sink, offers a seamless cooking experience, while the attached utility area adds to the convenience. Facilities This exquisite residence offers one covered car parking space, along with open common parking for two-wheelers, 24x7 water supply and 100 power backup, while 24x7 security with CCTV surveillance and a dedicated security guard ensures safety and peace of mind. The building is equipped with 2 high-speed lifts, a childrens play area, an open gym, and ample open space for walking and jogging, making it a perfect home for families of all ages.Locality The prestigious DPS Manikonda is within 1 to 1.5 km which is the nearest landmark from where a school is just 500 meters away, offering excellent educational options nearby. For healthcare needs, KIMS Hospital is within 1 to 1.5 km, providing top-tier medical facilities. Malls and supermarkets are located within a 3 to 4 km radius, ensuring all shopping and entertainment needs are met conveniently. Banks and ATM centers are nearby, adding to everyday ease. Commuting is effortless with the Outer Ring Road just a 5 to 7-minute drive away, facilitating quick access to various parts of Hyderabad. Public transport is readily available, the Raidurgam Metro Station just 4 km away and Lingampalli Railway Station within 12 to 15 km.",1570 sqft,,Resale,Furnished,3,,,8383 per sqft,
3 BHK Apartment for Sale in Gajularamaram Hyderabad,1.38 Cr,GYM AC Provisional Store Table Tennis Visitors Plaza Caroms Billiards Multi Purpose Hall Library SPAATM Driver Lounge Medical Shop Cafeteria Meditation Hall,1486 sqft,,Resale,Semi-Furnished,3,,"2 Covered,",6966 per sqft,RKs Oxygen Homes
"Plot/Land for Sale in Machabollaram, Medchal Road Hyderabad",1.25 Cr,"This exceptional residential plot offers a rare opportunity to build your dream home or investment property in one of Hyderabad's most well-connected and thriving neighborhoods. Situated in the sought-after Bolarum Market Area, this prime location combines convenience, accessibility, and potential for growth.::::::Property Specifications::::::::::::::Spanning an expansive 200 square yards, this plot is ready for immediate construction and comes with all essential amenities, including water, electricity, and a proper drainage system. Approved for ground + four floors, the property provides ample scope to design a multi-level home or a mixed-use building that caters to your specific needs.::::::The plot is east-facing, ensuring abundant natural light and positive energy, while its corner property status with north-east open sides adds to its appeal. A 25-foot-wide road in front of the plot enhances accessibility, making it an excellent choice for both residential and commercial purposes. Adding to its desirability, the plot is located directly on the main road, with nearby constructions boosting its value and signaling a well-developed neighborhood.::::::Locality::::::::::::::This plot's strategic location near essential amenities and public infrastructure makes it a standout choice for families and investors alike. Situated near a school, it ensures easy accessibility for families with children. Healthcare facilities are also within reach, with a hospital less than 1 km away, ensuring peace of mind during emergencies. For shopping and entertainment, a mall and supermarket are conveniently located within 1 km. Banking needs are well-catered to, with banks and ATMs available in the vicinity. ::::::Public transport is easily accessible, with buses and autos providing seamless connectivity to other parts of Hyderabad. The metro station, just 1 km away, and the railway station, within 8 km, enhance the locality’s accessibility, making it ideal for those who rely on public transportation.::",,,New Property,,,,,6944 per sqft,Bolarum Market Area
"Industrial Land for Sale in Uppal, NH 2 2 Hyderabad",1.48 Cr,"Discover a prime opportunity with this industrial land for sale in Uppal, Hyderabad, strategically located on a bustling main road. This property promises excellent visibility and accessibility, making it an ideal investment for businesses looking to establish a strong presence in the area.::::::Property Specifications::::::::::::Spanning an impressive 247 square yards, this ready-to-build plot boasts well-constructed boundary walls, ensuring security and privacy. The land is fronted by a 20-foot wide road, facilitating easy access for vehicles and deliveries. As a corner property, it benefits from two open sides, enhancing its appeal and potential for various commercial activities. The plot allows for the construction of up to two floors, providing ample space for expansion. ::::::Notably, essential utilities such as water, electricity, drainage, and seepage facilities are already in place, streamlining your development process and minimizing additional setup costs. Furthermore, there are existing constructions nearby, signaling a thriving community and potential client base.::::::Locality::::::::::Located near the landmark of Laxmi Narayan Nagar, beside Krishna Pharmacy, this property is nestled in a vibrant neighborhood. The surrounding area is well-equipped with schools and hospitals, ensuring that the community is serviced by essential amenities. Additionally, a variety of shopping options, including malls and supermarkets, are conveniently nearby, catering to both daily needs and leisure activities. ::::::Banks and ATMs are also within close proximity, enhancing the convenience for both business operations and personal transactions. Public transport is easily accessible, with buses and auto-rickshaws readily available, while a metro station located just 1 to 2 kilometers away further connects this location to the broader city network.::",,,Resale,,,,,6667 per sqft,
3 BHK Apartment for Sale in Yapral Hyderabad,1.42 Cr,,,2185 sqft,New Property,Unfurnished,3,,,6510 per sqft,
2 BHK Apartment for Sale in Kondapur Hyderabad,1.44 Cr,luxury gated community ready to move flats,1180 sqft,,New Property,Unfurnished,3,,1 Covered,10750 per sqft,Sumadhura Horizon
"Plot/Land for Sale in Tukkuguda, Srisailam Highway Hyderabad",1.20 Cr,Our Project is located south of upcoming future city of hyderabad with all amenities RERA Approved Project 100 Per Clear Title .,,,New Property,,,,,2222 per sqft,
3 BHK Apartment for Sale in Osman Nagar Hyderabad,1.44 Cr,"Acres  2. 8flats  300floors  15blocks  2east facing 15 0flats, west facing flats 150 flats2bhk  30 flats2. 5bhk  60 flats3bhk  195 flats4bhk  15 flatsclubhouse  5level with 16,000sqft",1297 sqft,,New Property,Unfurnished,3,,2 Covered,7620 per sqft,
3 BHK Apartment for Sale in Attapur Main Road Hyderabad,1.20 Cr,"MAHAVEER ESTATE PROJECTS is a leading property developer delivering premium lifestyles that offer convenience and liveability. We create masterplanned communities where our buyers can enjoy unparalleled comfort and amenity across all stages of life.With strong leadership at the helm, the business has set a strong vision and an ambitious growth path for itself. Founded in 1998, MAHAVEER ESTATE PROJECTSs has carved a niche for itself in terms of project delivery, with most projects being referred to as landmarks few even as benchmarks.MAHAVEER ESTATE PROJECTS believes in bringing serenity back",1312 sqft,,New Property,Unfurnished,3,Poss. by Dec '26,1 Covered,7317 per sqft,Mahaveer Crystal Garden
3 BHK Apartment for Sale in Old Nallakunta Hyderabad,1.25 Cr,"nallakunta 3 BHK flat for sale at good locality near to main road 24 hrs water, lift and car parking  more detailes contach for us",1350 sqft,,New Property,Semi-Furnished,3,,1 Covered,9260 per sqft,
3 BHK Apartment for Sale in Kapra Saket Road Hyderabad,1.20 Cr,1800 sft East face 3 bhk luxury flat fully furnished flat near saket towers main road near AS Rao Nagar ecil,1800 sqft,,New Property,Unfurnished,3,,2 Covered,6667 per sqft,
2 BHK Apartment for Sale in Gachibowli Hyderabad,1.11 Cr,"Kondapur is one of the prime locations to buy a home in Hyderabad. There are 394 residential projects in Kondapur. Some of the important landmarks near Candeur Lakescape are University of Hyderabad, Lingampally Railway Station, Oaltree Kidz International School, etc. With important facilities available in the vicinity, Kondapur surely is a suitable place to call home.  Limited Units Avilable Hurryup",890 sqft,,New Property,Unfurnished,2,Poss. by Apr '27,1 Covered,8599 per sqft,Candeur Lakescape
3 BHK Apartment for Sale in Nacharam Hyderabad,1.15 Cr,Its  a gated community project located in nacharam which is 3 km away from metro .Its one of the known project which has a good rental value and its a cost effective compared to all the projects near by.,1095 sqft,,Resale,Unfurnished,3,,1 Covered,7931 per sqft,
Plot/Land for Sale in Mokila Hyderabad,1.50 Cr,Mokila west Hyderabad  it is a booming place,,,Resale,,,,,6242 per sqft,Green City Gachibowli County
"3 BHK Apartment for Sale in Jyothi Rao Pule Colony, Serilingampally Hyderabad",1.09 Cr,Low density is the biggest usp here.,1100 sqft,,New Property,Unfurnished,3,,1 Covered,6927 per sqft,Fortune Greenhomes Sapphire
"3 BHK Apartment for Sale in Kollur, Outer Ring Road Hyderabad",1.42 Cr,"Multistorey Apartment for Sale in Kollur, Hyderabad. Covered area is 2040.0  Sq-ft. This property belongs to ""Anvita Ivana"" .",,2040 sqft,New Property,Unfurnished,3,Poss. by Dec '26,,6970 per sqft,Anvita Ivana
Plot/Land for Sale in Medchal Hyderabad,1.23 Cr,,,,New Property,,,,,4444 per sqft,
2 BHK Apartment for Sale in Adobe Aravindam Hyderabad,1.08 Cr,This is Brand New flat,,1350 sqft,New Property,Unfurnished,2,Poss. by Dec '25,,8000 per sqft,
3 BHK Apartment for Sale in Puppalguda Hyderabad,1.30 Cr,1715sft east facing flat good ventilation,1300 sqft,,Resale,Semi-Furnished,3,,,7580 per sqft,
"2 BHK Apartment for Sale in Alkapur Township, Manikonda, Outer Ring Road Hyderabad",1.16 Cr,"FLAT FOR SALEARYA MITRA BY FLORA, ALKAPURI TOWNSHIP, 100 FEET ROAD2 BHK  2 BED ROOMS  2 BATH ROOMSEAST FACINGB BLOCK1370 SFT5TH FLOORUDS 54 SQ YARDSTop Amenities in Aryamitra FloraLiftBanquet HallMultipurpose HallRain Water HarvestingSwimming PoolGymnasiumReserved Parking",1100 sqft,,Resale,Unfurnished,2,,1 Covered,8467 per sqft,
3 BHK Apartment for Sale in Puppalguda Hyderabad,1.50 Cr,Prime Location,,1360 sqft,New Property,Semi-Furnished,2,,,11029 per sqft,EIPL CORNERSTONE
3 BHK Apartment for Sale in Ameenpur Hyderabad,1.28 Cr,,,1509 sqft,New Property,Unfurnished,2,Poss. by Dec '26,,8482 per sqft,Urbanrise The World Of Joy
Plot/Land for Sale in Manikonda Jagir Hyderabad,1 Cr,"prime location, near gandhi statchue ,close to highway",,,New Property,,,,,5556 per sqft,Akshaya
"3 BHK Apartment for Sale in Kollur, Outer Ring Road Hyderabad",1.28 Cr,"Our Property is HMDA RERA approved Project, Gated Community, with luxury Amenities, Very near Schools, Colleges and Hospitals,",2300 sqft,,New Property,Unfurnished,3,Poss. by Nov '28,2 Covered,5603 per sqft,ANVITA HIGH9
"3 BHK Apartment for Sale in Kukatpally, NH 9 Hyderabad",1.29 Cr,"Premium Luxury 3BHK Flats in a Secure Gated Community  Ready to Move In Discover an extraordinary lifestyle in the heart of Hitech City, Hyderabads most elite tech and residential hub. Were offering spacious, readytomove 3BHK luxury flats with elegant designs and worldclass amenities  all in a gated community that ensures peace, privacy, and prestige. LimitedTime Offer  Only 7,199sq.ft at a Prime Location Why Choose This Property Premium 3BHK flats with superior construction and luxury fittings Located in Hitech City  close to major IT companies, malls, schools",1680 sqft,,New Property,Unfurnished,3,,2 Covered,7199 per sqft,
2 BHK Apartment for Sale in Puppalguda Hyderabad,1.45 Cr,2bhk flat for sale for more details contact on given number,,1514 sqft,New Property,Unfurnished,2,Poss. by Aug '25,,9577 per sqft,Aparna Zenon
3 BHK Apartment for Sale in Chanda Nagar Hyderabad,1.17 Cr,Project designed as per HMDA Norms,1508 sqft,,New Property,Unfurnished,3,Poss. by Aug '25,,6880 per sqft,
Plot/Land for Sale in Maheshwaram Hyderabad,1.13 Cr,,,,New Property,,,,,3167 per sqft,
"Plot/Land for Sale in Chilkur Balaji Temple Road, Chevella Road Hyderabad",1 Cr,"Eco friendly best resort in Hyderabad, 24hrs High Security, venture around fencing, best for living a gated community with greenery.",,,Resale,,,,,2222 per sqft,
2 BHK Apartment for Sale in Gachibowli Hyderabad,1.50 Cr,good property,,1275 sqft,Resale,Semi-Furnished,2,,,11765 per sqft,My Home Vihanga
4 BHK  House for Sale in Nagaram Hyderabad,1.39 Cr,New house for sale at rampally 200 sqyds g  1  near styanager colony near by main road.,,200 sqyrd,New Property,Unfurnished,4,,"1 Covered,",7722 per sqft,
Plot/Land for Sale in Velmala Hyderabad,1.20 Cr,"About ProjectDRIVE TO DESTINATION OF PROSPERITYEmergency of a Global City Hyderabad The Real Growth Story.Green City Dukes County near Velimela is located on 100 ft wide road that enjoys strategically a central location. Developed by one of the celebrated Developers of Hyderabad, the layout is a rst class property that has hiend details in amenities. Available in 165 to 400 Sq Yds approximately, these plots promise peaceful lifestyle and value to your investment. BT roads, avenue plantation, street lighting, designer landscaping and play areas offer the ideal lifestyle. Join a cosmopo",,,Resale,,,,,5000 per sqft,Green City Dukes Estates
"2 BHK Apartment for Sale in Narsingi, Outer Ring Road Hyderabad",1.43 Cr,3bhk flat eat and west facing available,,1370 sqft,Resale,Unfurnished,2,,1 Covered,10438 per sqft,Rajapushpa Provincia
"2 BHK Apartment for Sale in Kollur, Outer Ring Road Hyderabad",1.02 Cr,near to Gachibowli Nanakramguda kokapet near to school and near ORR more connectivity,842 sqft,,New Property,Unfurnished,3,Poss. by Dec '25,,8095 per sqft,Anvita Ivana
3 BHK Apartment for Sale in Chanda Nagar Hyderabad,1.03 Cr,East facing fully ventilated flat .,1400 sqft,,New Property,Unfurnished,3,,1 Covered,6700 per sqft,
Plot/Land for Sale in Kothur Rangareddy Hyderabad,1.44 Cr,80 Acres Gated with 900 yds and above size plots for a farm house living,,,Resale,,,,,1333 per sqft,
2 BHK Apartment for Sale in Sangeet Nagar Kukatpally Hyderabad,1.20 Cr,"2 BHK, recently furnished with Luxury look. Wardrobes in both rooms, TV Unit, Pooja Table, Shoe Rack, Modular Kitchen, Elica Chimney, Storage in Wash area, 2 Covered Car Parking. Mosquito net is installed. 247 power backup and Security. Clubhouse, banquet hall, Gym, Swimming, Lawn Tennis, badminton, cricket, basketball, Play Area, Beauty Salon, Grocery and Vegetable Shop, Medical Shop, within Society.. Metro Station, Dmart, Metro Cash  carry, Ashoka One mall, Creek International School, and Multi speciality Hospital within 500m, 1km.",,1095 sqft,Resale,Semi-Furnished,2,,2 Covered,10959 per sqft,Emami Swanlake
2 BHK Apartment for Sale in Khajaguda Nanakramguda Road Hyderabad,1.10 Cr,Futuristic location with access to Happening places around. Delhi Public school in next compound.,1053 sqft,,Resale,Semi-Furnished,2,,2 Covered,11653 per sqft,Jains Carlton Creek Phase II
3 BHK Apartment for Sale in Nalagandla Hyderabad,1.44 Cr,,,1650 sqft,New Property,Unfurnished,3,Poss. by Jul '28,1 Covered,8749 per sqft,
3 BHK Apartment for Sale in Bachupally Hyderabad,1.40 Cr,,,1617 sqft,Resale,Unfurnished,3,,,8658 per sqft,Urbanrise On Cloud 33
3 BHK Apartment for Sale in Bachupally Hyderabad,1.20 Cr,,,1524 sqft,New Property,Semi-Furnished,3,,,7874 per sqft,Risinia Oyster Risinia Builders
3 BHK Apartment for Sale in Serilingampalle M Hyderabad,1.39 Cr,"Step into a world of elegance with this stunning 3 BHK flat for sale in Candeur Crescent, Serilingampally, Hyderabad! Nestled in a vibrant neighborhood, this remarkable residence offers a perfect blend of luxury and modern living designed to elevate your lifestyle.::::::Note– This property is currently under construction and will be ready for possession in August 2025.::::::Property Specifications::::::Spanning an impressive 1601 sq ft of super built-up area, this exquisite flat is located on the 14th floor of a contemporary 50-story building. With beautiful vitrified tile flooring throughout, the apartment showcases a sleek, modern aesthetic that is sure to leave a lasting impression.::::::Designed with Vastu principles, this West-facing flat invites positive energy, fostering a harmonious atmosphere. Unfurnished, this unit offers the freedom to design your space your way.::::::As you enter, the expansive living cum dining area welcomes you, providing the perfect backdrop for unforgettable family gatherings and lively entertaining. Plus, three well-appointed bedrooms offer a harmonious blend of space and privacy. With three Western-style bathrooms—two attached and one common—all equipped with geyser points, your daily routines will feel luxurious. A balcony off the hall offers clubhouse views, while the stylish kitchen with piped gas and utility ensures a seamless cooking experience.::::::Facilities::::::This flat comes with covered parking, 24-hour water supply, and 100% power backup, guaranteeing uninterrupted comfort. Security is a top priority, with a dedicated security guard on duty and CCTV cameras installed throughout the premises. Plus, the building features four lifts, providing easy access to all the floors.::::::The amenities in this building are unparalleled, including a conference room, bank & ATM, reserved parking, visitor parking, maintenance staff, banquet hall, private terrace/garden, health club with steam/jacuzzi, meditation area, indoor games room, indoor squash & badminton courts, kids club, outdoor tennis courts, cycling & jogging track, aerobics room, swimming pool, gymnasium, grand entrance lobby, event space & amphitheater, clubhouse, flower gardens, guest lobby in each floor, fire fighting equipment, and intercom facility.::::::Locality::::::Nestled near Lingampally railway station, this flat offers unparalleled convenience. Placed near Santa Maria International School, it ensures easy access to quality education. Continental Care Hospital is just 1 km away, providing excellent healthcare facilities. Malls and supermarkets are within walking distance, as are banks and ATMs. Public transport is readily available, making commuting a breeze.::::::Don’t miss out on the opportunity to make this exquisite property your home! Schedule a visit today and experience the charm and elegance for yourself!::::",,1601 sqft,Resale,Unfurnished,3,,,8682 per sqft,Candeur Crescent
"2 BHK Apartment for Sale in Tellapur, Outer Ring Road Hyderabad",1.38 Cr,near by international school near by shopping mall nearby road near by hospital near by orr,1200 sqft,,New Property,Semi-Furnished,2,,"1 Covered,",11014 per sqft,My Home Tridasa
3 BHK Apartment for Sale in Mansoorabad Road Hyderabad,1.20 Cr,"3 BHK Flat For Sale in Tangrilla Homes, Sagara Main Road, Pragati Nagar, Mansoorabad, Hyderabad. Vaastu compliant and East facing for a harmonious and peaceful lifestyle.Property SpecificationsThis beautifully furnished 3 BHK flat is located on the 3rd floor of a 5-floor building, offering a carpet area of 1605 sqft. The flat features three spacious bedrooms, each with attached western-style bathrooms equipped with geysers for your comfort. The living and dining area is designed in an L-shape, providing a roomy and inviting space for family gatherings. A wooden pooja unit adds a traditional touch to the home. The modular kitchen comes with a chimney, piped gas connection, and an attached utility area for convenience. Vitrified flooring throughout the flat enhances the aesthetic appeal and durability.Facilities Residents can enjoy various facilities such as covered parking, 24-hour water supply, 100 power backup, round-the-clock security, CCTV surveillance, and two lifts for easy access. The community amenities include a clubhouse, swimming pool, kids play area, and fire fighting equipment, ensuring a safe and enjoyable living environment.Locality Situated opposite the BPCL Petrol Pump, the locality is well-connected and offers easy access to schools, hospitals, malls, supermarkets, banks, and ATMs within walking distance. Public transport options like buses and autos are readily available, and the LB Nagar Metro Station is 3 km away, making commuting convenient and hassle-free.",1550 sqft,,Resale,Furnished,3,,1 Covered,7477 per sqft,Tangrilla Homes
3 BHK Apartment for Sale in Kondapur Hyderabad,1.25 Cr,"Looking for a 3 BHK property for sale in Hyderabad Buy this 3 BHK flat in Aishwarya Residency that is situated in Kothaguda, Hyderabad. The flat occupies a Built Up area of 1650 sq.ft. that consists of 3 bedrooms, 3 bathrooms and 1 balcony. The property is located on the 3rd floor of a 5 floors tall building. Being a ready to move project, you can expect immediate possession of this 510 years old property.",,1650 sqft,Resale,Semi-Furnished,3,,1 Covered,7576 per sqft,Aishwarya Residency
"2 BHK Apartment for Sale in Miyapur, NH 9 Hyderabad",1.20 Cr,nearby d mart Opp mutarotation 5mm good location,1100 sqft,,Resale,Semi-Furnished,2,,1 Covered,9926 per sqft,Candeur 40
2 BHK Apartment for Sale in Gandipet Hyderabad,1.45 Cr,The property is 2bhk east facing good balcony view and specious hall and bedrooms,1250 sqft,,Resale,Unfurnished,2,,1 Covered,10284 per sqft,EIPL Apila
