Title,Price (INR),Description,Carpet Area,Super Area,Transaction,Furnishing,Bathroom,Possession,Car Parking,Price per Sqft,Society
3 BHK Apartment for Sale in Peeramcheru Hyderabad,1.17 Cr,,,1680 sqft,New Property,Unfurnished,3,Poss. by Dec '25,1 Covered,6999 per sqft,
3 BHK Apartment for Sale in Bachupally Hyderabad,1.43 Cr,"Multistorey Apartment for Sale in Bachupally, Hyderabad. Covered area is 1914.0  Sq-ft. This property belongs to ""Urbanrise On Cloud 33"" .",,1914 sqft,New Property,Unfurnished,3,Poss. by Mar '26,,7499 per sqft,Urbanrise On Cloud 33
"Plot/Land for Sale in Kothur, NH 7 Hyderabad",1.14 Cr,"Residential Plot for Sale in Kothur, Hyderabad. Covered area is 600.0  Sq-ft. This property belongs to ""Pavani Royale"" .",,,New Property,,,,,2111 per sqft,Pavani Royale
3 BHK Apartment for Sale in Nizampet Hyderabad,1.50 Cr,"3 BHK, Multistorey Apartment is available for Sale in Nizampet, Hyderabad for 1.5 Crore(s)",,1680 sqft,Resale,Semi-Furnished,3,,,8929 per sqft,Maruthi Elite
3 BHK Apartment for Sale in Ameenpur Hyderabad,1.23 Cr,East Facing Flats 2BHK  3BHK at Ameenpur Hyderabad,1800 sqft,,New Property,Semi-Furnished,3,Poss. by Jul '29,"2 Covered,",5999 per sqft,
Plot/Land for Sale in Maheshwaram Hyderabad,1 Cr,"Nestled in the thriving corridor of Maheshwaram, Myakala & Akshita's Visionary City spans 90 acres of premium villa plots, purposefully designed for future-ready living and high-growth investment potential. Strategically located with seamless connectivity to the Outer Ring Road and Hyderabad International Airport, this coveted address is just minutes away from the city's rapidly advancing tech hubs—Fab City, E-City, Future City, and EMC City.",,,New Property,,,,,2778 per sqft,Akshita Visionary City Golden Breeze Phase4
Plot/Land for Sale in Mankhal Hyderabad,1.50 Cr,"immediatly constrution area, all facilities are available schools, hospitals , shops, function halls, corporate conpaniesx high rise apartments, etc.",,,Resale,,,,,6242 per sqft,
Plot/Land for Sale in Sahebnagar Kalan Hyderabad,1.03 Cr,"PLOT FOR SALEPlot no 15265 Sq.yds  40 X 60 Dimension39,000 per sq.ydPadmavathi nagar colony, Vanasthalipuram, HyderabadFor More Details Contact   9666 859 159,  836 706 2312",,,Resale,,,,,4333 per sqft,
Office Space for Sale in Bachupally Hyderabad,1.30 Cr,"Here is a fantastic opportunity to own office space for sale in Bachupally, Hyderabad, offering a covered area of 1300 sq-ft. Situated in a prime and well-connected location, this property promises excellent potential for businesses seeking a convenient and accessible workspace in a bustling commercial area.Property SpecificationsThis spacious and strategically located office space covers a carpet area of 947 sqft and is situated on the ground floor of a well-constructed 4-floor building. The open hall layout offers great flexibility, making it ideal for a wide range of business purposes. Whether you're planning to establish a call center, BPO, coaching center, private consulting, doctor’s clinic, IT/ITES setup, or even a boutique or restaurant, this property can be tailored to your needs. The space is also vaastu compliant and east-facing, ensuring a positive and conducive working environment.The property features two washrooms, providing convenience for employees and clients alike. The flooring is done with vitrified tiles, ensuring both durability and easy maintenance. With large windows that allow for ample natural light and ventilation, this space feels bright and airy, creating a comfortable atmosphere for both work and creativity. The office is also main road-facing, offering great visibility and easy access for clients and employees.Facilities In terms of facilities, the office space comes with both covered and open parking, ensuring enough parking for both employees and visitors. The property also guarantees 24/7 water supply from both borewell and corporation sources, and a 100% power backup facility ensures uninterrupted work. A dedicated security guard and CCTV surveillance provide added safety and peace of mind.Locality Locality-wise, this property enjoys great connectivity, being situated near the prominent Bachupally Circle. It is surrounded by essential amenities, with hospitals located within 300 meters, malls and supermarkets within a 3 km radius, while banks and ATMs nearby. The area also offers easy access to public transport, with buses and autos readily available. The Miyapur Railway and metro stations are 6.8 km away, enhancing the property's accessibility.",947 sqft,,New Property,,2,,1 Covered,10000 per sqft,
2 BHK Apartment for Sale in Moti Nagar Erragadda Hyderabad,1.35 Cr,"Multistorey apartment is available for sale. It has covered area 1177 sq-ft, it is 2 BHK apartment. Please contact for more details.",,1177 sqft,Resale,Furnished,2,,1 Covered,11470 per sqft,Brigade Citadel
3 BHK  House for Sale in Kapra Hyderabad,1.50 Cr,"Duplex Independent House in Bhaskar Rao Nagar Well Ventilated Furnished House SROHYD440002 Maruthiram K,Jagdish G V",,139 sqyrd,Resale,Furnished,3,,1 Covered,11990 per sqft,
"3 BHK Apartment for Sale in Narsingi, Outer Ring Road Hyderabad",1.30 Cr,"2 Clubhouses Banquet Halls, Party Lawns  Multipurpose Halls Restaurant  Food Court Mini Theatre Swimming Pool Indoor  Outdoor Fitness Centres Walking  Jogging Tracks Sports ArenaKidsPlayArea",1650 sqft,,New Property,Unfurnished,3,Poss. by Aug '28,,7402 per sqft,Vasavi Atlantis
"3 BHK Apartment for Sale in Kollur, Outer Ring Road Hyderabad",1.28 Cr,"1 mint from Gaudium School, 15 mins from Kokapet SEZ, power backup, 5mins  from Exit2  Exit3",1387 sqft,,New Property,Unfurnished,3,Poss. by Dec '26,2 Covered,6949 per sqft,Samracana Swasthi
Plot/Land for Sale in Shadnagar Hyderabad,1.15 Cr,"Residential Plot for Sale in Shadnagar, Hyderabad. Covered area is 500.0  Sq-ft. This property belongs to ""Golden Terra"" .",,,New Property,,,Poss. by Dec '25,,2556 per sqft,Golden Terra
3 BHK Villa for Sale in Kompally Hyderabad,1.05 Cr,"SLN GROUPS VILLAS 167 sqyds Buildup area 2234 G2 2250 sft Ground floor Hall, kitchen, 1 bedroom  1St floor 2 Bedrooms 2St floor 1 Bedrooms 1 home theatre With full Greenary  With full fall ceiling  Bore separate 5 Gst 100 vasthu",1850 sqft,,New Property,Unfurnished,3,Poss. by May '26,"1 Covered,",4667 per sqft,
3 BHK Apartment for Sale in Bachupally Hyderabad,1.26 Cr,"Providing a fantastic opportunity to purchase a 3 BHK flat in Urbanrise On Cloud 33, Bachupally, Hyderabad. This expansive property offers modern living in a well-connected and peaceful location.Property SpecificationsThis under-construction has possession from 1st July 2025 and is located over an area of 1353 sqft of super built-up area. The flat is on the 31st floor of a 33-story building and is not furnished, giving you the liberty to decorate your house in your own way. The property is east facing and is vaastu compliant, giving you a good inflow of positive energies in the flat.It has 3 bedrooms and 2 bathrooms, one attached to the master bedroom and the other being a common bathroom. Both the bathrooms have geyser points and western-style fittings. The living-cum-dining room has a big window opening onto a balcony with a serene view of the open space. The kitchen has a plain platform and sink, and there is a piped gas connection. Also included is a utility area that hooks up to the kitchen for extra convenience. The floors are tiled, offering a smooth, easy-to-clean surface.FacilitiesYou are provided with covered parking for your car and 24/7 supply of water from borewell and corporation sources. It has 100% power backup, ensuring continuous services. Safety is ensured through the availability of security personnel at all times and CCTV surveillance on the premises. The complex is equipped with 6 lifts, making it convenient for easy access to all levels. There is a rooftop facility, kids' play area and clubhouse where one can relax and enjoy beautiful views.LocalityThe flat is located close to Mamata Institute of Medical Sciences, so it is an ideal place for healthcare and other necessary services. Schools are nearby within 1 to 2 km, malls and supermarkets are within 5 km. Banks and ATMs are nearby to suit your needs. Public transportation such as buses and autos is easily available. The Lingampally railway station is just a distance of 6 km from the property. The Miyapur metro station is approximately 4 km from the property.",,1353 sqft,Resale,Unfurnished,2,,,9313 per sqft,Urbanrise On Cloud 33
3 BHK  House for Sale in Jeedimetla Hyderabad,1.30 Cr,"A residential house is available for sale. It covered area of 1800 sq-ft, it is a good location. Please contact for more details.",1700 sqft,,Resale,Unfurnished,4,,,7222 per sqft,
Plot/Land for Sale in Kattedan Road Hyderabad,1.32 Cr,"kattedan , aphb colony very peaceful place clean and clear property.",,,Resale,,,,,5535 per sqft,
"3 BHK Apartment for Sale in Kollur, Outer Ring Road Hyderabad",1.04 Cr,"Investors Flats Premium 3bhk flats in 8 Acres 14 Floors Premium Gated Community with World Class Amenities and Clubhouse at Pati, Velimela near Kollur Exit. Surrounded by International School and Many Residential Projects.",,1700 sqft,New Property,Unfurnished,3,Poss. by Dec '25,1 Covered,6118 per sqft,
3 BHK Apartment for Sale in Adarsh Nagar Uppal Hyderabad,1.37 Cr,"3 BHK, Multistorey Apartment is available for Sale in Adarsh Nagar Uppal, Hyderabad for 1.3 Crore(s)",1644 sqft,,New Property,Unfurnished,3,Poss. by Dec '25,,6687 per sqft,Udaya Skyvert
"3 BHK Apartment for Sale in JV Hills, Kondapur Hyderabad",1.07 Cr,New Flats in KONDAPURHome Options Available 3 BHKs  1860 sft  2150 sft  2700 sft Duplex 4 BHKs Ground  First Floor 3406 sft  3656 sft  4360 sft Sky Villas 4 BHKs Top Floors 3600 sft  4300 sft  5260 sft,1800 sqft,,New Property,Unfurnished,3,Poss. by Aug '28,1 Covered,4999 per sqft,
"2 BHK Apartment for Sale in Alkapur Township, Manikonda, Outer Ring Road Hyderabad",1.04 Cr,Total Area10 ACRESTotal Units850 unitsTotal Blocks6BUILDINGSFloorsG16 floors2BHK sizes1375sft to 1475sft2.5BHK sizes1390sft to 1585sft3BHK sizes1680sft to 3210sft.LocationNarsingi,,1375 sqft,New Property,Unfurnished,2,Poss. by Jul '26,1 Covered,7585 per sqft,Ananda The Drizzle
"2 BHK Apartment for Sale in Hafeezpet, NH 9 Hyderabad",1.01 Cr,"Near hi tech city and ITI hub,  near malls and shilparamam",875 sqft,,New Property,Unfurnished,2,Poss. by Mar '26,2 Covered,8100 per sqft,Vasavi Lake City
3 BHK Apartment for Sale in Chanda Nagar Hyderabad,1.45 Cr,"Welcome to Bahiti  Where Every Moment Elevates YouThis isnt just a residence. Its your daily dose of inspiration. Wake up to sunlight dancing on the water, energize your body in a stateoftheart gym, and find your center in a skyhigh yoga studio that feels like a sanctuary.At Bahiti, wellness isnt a weekend plan  its part of your everyday rhythm.Perfectly connected to the city yet cocooned in tranquility, Bahiti is your personal retreat. Here, balance isnt a goal  its a way of life.Live brighter. Move freer. Be more. Only at Bahiti.Features  AmenitiesDedicated kids",1557 sqft,,New Property,Unfurnished,3,Poss. by Mar '27,1 Open,6996 per sqft,
"3 BHK Apartment for Sale in Patighanpur, Outer Ring Road Hyderabad",1.10 Cr,"Multistorey Apartment for Sale in Patighanpur, Hyderabad. Covered area is 2042.0  Sq-ft. This property belongs to ""Riddhis Taranto Towers"" .",,2042 sqft,New Property,Unfurnished,3,Poss. by Dec '28,,5400 per sqft,Riddhis Taranto Towers
3 BHK Apartment for Sale in Gachibowli Hyderabad,1.20 Cr,East And west Facings available in gated community .....,1497 sqft,,New Property,Furnished,2,Poss. by Dec '25,1 Covered,8016 per sqft,
"4 BHK Apartment for Sale in Dundigal, Outer Ring Road Hyderabad",1.03 Cr,"Akshaya Vasu Sri Pride sets a new benchmark in urban living with thoughtfully designed amenities, expansive open spaces, and familyfriendly environments. Surrounded by lush greenery and vibrant play areas, it offers a serene, joyful atmosphere for all ages. Strategically located near Outer Ring Road ORR, it blends tranquility with convenience. With spacious 2BHK, 3BHK, and 4BHK apartments, Vasu Sri Pride enhances the modern living experience, making each day more pleasant and fulfilling.",1623 sqft,,New Property,Unfurnished,4,Poss. by Oct '25,1 Covered,4799 per sqft,Vasu Sri Pride
"3 BHK Apartment for Sale in Moosapet, NH 9 Hyderabad",1.35 Cr,"Cybercity Oriana is one of Hyderabads most sought after destination for apartments and this 3 BHK flat in Hi Tech City is your opportunity to be a part of this community. The flat occupies a Super built up area of 1480 sq.ft. that consists of 3 bedrooms, 3 bathrooms and 1 balcony. The flat has a total of 27 floors and this property is situated on 17th floor. As the property is currently under construction , you can expect to get the possession by December 2025. The flat will offer a modern lifestyle as it is presented with many of the amenities such as Swimming Pool, CCTV Surveillance, Club house  Community Center, Fitness Centre  GYM, Park and Lifts.",,1480 sqft,New Property,Unfurnished,3,Poss. by Dec '25,1 Covered,9122 per sqft,Cybercity Oriana
2 BHK Apartment for Sale in Prasanth Nagar Miyapur Hyderabad,1 Cr,"2 BHK, Multistorey Apartment is available for Sale in Prasanth Nagar Miyapur, Hyderabad for 1.0 Crore(s)",1100 sqft,,Resale,Unfurnished,2,,,8333 per sqft,
2 BHK Apartment for Sale in Osman Nagar Hyderabad,1.08 Cr,"Book Now, pay after RERAProject Area  13 AcresNo of Towers  6No of Floors  39Unit Configuration  2. BHK  1420 sq.ft 3 BHK   1740 sq. ft 3 BHK  2030 sq. ft 4 BHK  3500  4400 sq. ft StepwayDesigned Clubhouse  1,35,000 sq. ft  G7 floors Rooftop Infinity Pool   Skydeck Lounge   Indoor Games  Wellness Zones Accepting EOI Expression of Interest 2 BHK  5 Lakhs 3 BHK   10 Lakhs",1065 sqft,,New Property,Unfurnished,2,Poss. by Jul '28,1 Covered,7606 per sqft,
2 BHK Apartment for Sale in Manikonda Jagir Hyderabad,1.35 Cr,"Enter your home of dreams with this welcoming 2 BHK apartment available for sale in the center of Manikonda, Hyderabad. Carefully thought out with Vaastu consideration, this home brings positive energy into every space. Relish the comfort of a west-facing floor plan that floods your living areas with warm golden light.Property SpecificationsExperience contemporary living in this apartment covering a super area of 1335 sq. ft., located on the 2nd level of a 10-storey building. The semi-furnished home boasts two spacious bedrooms, one master bedroom with an en-suite bathroom, and another common bathroom, both furnished with chic western fittings.Relish peaceful moments on the balcony opening from the bedroom that provides scenic vistas of green surroundings. The flat has a clearly differentiated plan with a separate living and dining space, ideal for entertaining friends and relatives.Modular kitchen is planned with efficiency and style in mind, including a piped gas line and a useful utility space for all of your kitchen requirements. Sophisticated vitrified tiles cover the flooring everywhere, adding to the overall appearance of the house.FacilitiesThe property also features a range of basic facilities such as covered parking, 24-hour assured water supply, and 100 power back-up to provide seamless living. Safety is also the priority, with a watchman on duty, CCTV cameras for added peace of mind, and two lifts for easy inter-floor movement.Residents can also enjoy a variety of well-designed amenities like a vibrant kids playground, a tastefully equipped gym, a beautifully landscaped garden, a welcoming clubhouse, and a refreshing swimming pool.LocalitySituated in the midst of bustling Ghanshyam Super Market, this area offers just the right balance of accessibility and convenience. There are schools and hospitals in the vicinity, making basic services easily accessible to the residents. Public transport is within reach, so reaching out is always convenient, and banks and ATMs are readily accessible to make financial transactions hassle-free. The metro station proximity increases the connectivity, and thus, it is an excellent choice for modern living",1300 sqft,,Resale,Semi-Furnished,2,,,10112 per sqft,ASBL Lakeside
3 BHK Apartment for Sale in Puppalguda Hyderabad,1.47 Cr,"3 BHK, Multistorey Apartment is available for Sale in Puppalguda, Hyderabad for 1.4 Crore(s)",,1500 sqft,New Property,Unfurnished,2,Poss. by Mar '26,,9800 per sqft,Sukhii Ubuntu
"3 BHK Apartment for Sale in Kollur, Outer Ring Road Hyderabad",1.19 Cr,"3 BHK, 2075 Sq ft, 8th floor, East facing, un furnished flat.",1600 sqft,,Resale,Unfurnished,3,Poss. by Dec '25,2 Covered,5735 per sqft,Abinandana Skylark 1
2 BHK Apartment for Sale in Navodaya Colony Kukatpally Hyderabad,1.02 Cr,"2  3 BHK GATED COMMUNITY UNDER CONSTRUNCTION FLATS  BHAVYAS AVANI TULASIVANAM, KUKATPALLYLEGEND Entrance  Security, Drive Way, Swimming Pool Main Pool, Kids Pool Bicycle Lane     Changing Room Stage  Feature Wall   Party Lawn  Path Way  Childrens and Toddlers play area Interaction Zone  Skating Ring Badminton court Butterfly GardenPROJECT FEATURES Gated Community 33 Floors A to L except J 11 Floors Block J 12 Towers 2684 Units 2 3 BHK   Vaasthu Sports Complex Pollution Free Atmosphere    Rainwater Harvest Pits",1166 sqft,,New Property,Unfurnished,2,Poss. by Sep '25,1 Covered,7000 per sqft,Bhavyas Tulasivanam Avani
3 BHK Apartment for Sale in Manikonda Jagir Hyderabad,1.22 Cr,"Our residential apartment development aims to provide modern living spaces tailored to the needs of individuals and small families. With a focus on efficient design and functional amenities, our project seeks to create a vibrant community atmosphere while offering comfortable and affordable housing options in a convenient urban location. We prioritize sustainability and quality craftsmanship to ensure a long-lasting and enjoyable living experience for our residents.",,1750 sqft,New Property,Unfurnished,3,,1 Covered,7000 per sqft,Concrete Strings
Plot/Land for Sale in Sangareddy Hyderabad,1.39 Cr,"Residential Plot for Sale in Sangareddy, Hyderabad. Covered area is 556.0  Sq-ft. This property belongs to ""Bhagyaprastha County"" .",,,New Property,,,,,2778 per sqft,Sri Vaarahi Bhagyaprastha County
"2 BHK Apartment for Sale in Miyapur, NH 9 Hyderabad",1.05 Cr,2BHK 1215sft North Facing Flat For Sale in Candeur40.....Nine Four Four Zero Six Two Seven Five Six Zero,760 sqft,,Resale,Unfurnished,2,Poss. by Aug '25,1 Covered,8642 per sqft,Candeur 40
3 BHK Apartment for Sale in Miyapur Main Road Hyderabad,1.36 Cr,"The multple units are available like East, West  North facing. Its prime location",1283 sqft,,New Property,Unfurnished,3,Poss. by Oct '27,"1 Covered,",7999 per sqft,Team 4 Nyla
3 BHK Apartment for Sale in Shamshabad Hyderabad,1.07 Cr,"Our Property HMDA RERA Approved project located in prime location, Highway facing with all Luxury and 24 hrs security Gated Community Project.",1111 sqft,,New Property,Unfurnished,2,Poss. by Dec '26,"1 Covered,",6750 per sqft,
"2 BHK  House for Sale in Indresham, Bachuguda Hyderabad",1.20 Cr,"2 Shutters Ground floor, 2BHK 1st Floor, Rental Income 30,000 PM",900 sqft,,Resale,Semi-Furnished,2,,1 Covered,13333 per sqft,
3 BHK Villa for Sale in Malkajgiri Hyderabad,1.20 Cr,"3 BHK Villa For Sale in Taruna Residency, Malkajgiri, Hyderabad  a conveniently and well-located, east-facing, Vaastu-compliant house providing a serene and hassle-free lifestyle in a prime residential area.Property SpecificationsThe spacious 1300 sqft super built-up area 3 BHK villa is divided into two floors G plus 1. The semi-furnished villa has wardrobes, a sofa, air conditioners, and a TV unit, thus being ready to move into for a comfortable lifestyle.On the ground floor, there is one bedroom, two toilets one attached and one common, one Indian type and one Western type, both with geysers, a living room, and a modular kitchen with a piped gas connection. There is an attached utility area for extra convenience in the kitchen. There is an internal staircase to link to the first floor.The first floor has two bedrooms, each with a western-style bathroom attached, equipped with geysers, and one of the bedrooms has a balcony facing adjacent buildings. Flooring in the villa is in luxurious marble that adds to the beauty.FacilitiesParking is available in open spaces. The building is augmented with a 24-hour water supply through a borewell and corporation water.LocalitySituated in a prime location close to East Anandbagh, the villa is easily accessible to vital facilities. Hospitals and schools are between 500 meters to 1-km distance, and malls and supermarkets are around 1 km away. Banks and ATMs are conveniently located nearby. Public transport facilities, such as buses and autos, are easily accessible, and the nearest Safilguda Railway Station is only 2 km away, allowing hassle-free daily travel.",1200 sqft,,Resale,Furnished,4,,,9231 per sqft,Taruna Residency
"3 BHK Apartment for Sale in Kollur, Outer Ring Road Hyderabad",1.42 Cr,"For those looking to buy a residential property, here comes one of the choicest offerings in Hyderabad, at Osman Nagar. Brought to you by Vajra Infra Corp India, Vajra West City is among the newest addresses for homebuyers. There are apartments for sale in Vajra West City Osman Nagar, Tellapur. This is a new launch project right now, and is expected to be delivered by May, 2028 .",1400 sqft,,New Property,Unfurnished,3,Poss. by May '28,1 Covered,7000 per sqft,Vajra West City Phase 1
"3 BHK Apartment for Sale in Tellapur, Outer Ring Road Hyderabad",1.08 Cr,"Vision Arsha  Tellapur Ultra Luxurious High Rise Gated Community Apartments Project.Upgrade, moving lifestyle  to a better community.Exclusive 2  3 BHKs Every Flat is a corner with Plenty of Airflow and Ventilation.Project Details 11 Acres7 Towers G28 Floors1561 UnitsSpecifications EV pointsClub House 68,000 sft Fully Loaded Club House with World Class AmenitiesTwo Amenities Blocks.Tellapur is one of the growing residential Hubsconnects to all the major International Schools and Malls",,1625 sqft,New Property,Unfurnished,3,Poss. by May '26,"1 Covered,",6700 per sqft,
3 BHK Apartment for Sale in Srisailam Highway Hyderabad,1.43 Cr,First gated community in Tarnaka with lavish club house and all the facilities,1158 sqft,,New Property,Unfurnished,3,Poss. by Mar '27,1 Open,8140 per sqft,Indraprastha
"Office Space for Sale in Financial District, Nanakram Guda Hyderabad",1.10 Cr,A Graded Commercial building for office spaces. UDSC 6 square yards for every 1000sft office space.,900 sqft,,New Property,,> 10,Poss. by Nov '25,1 Covered,11000 per sqft,Viana Poojitha Tech Park
2 BHK  House for Sale in Old Bowenpally Cross Road Hyderabad,1.20 Cr,"A residential house is available for sale. It has a covered area of 1024 sq-ft, it is a good location. Please contact for more details.",900 sqft,,Resale,Semi-Furnished,2,,,11719 per sqft,
3 BHK Apartment for Sale in Budwel Hyderabad,1.47 Cr,"Multistorey Apartment for Sale in Budwel, Hyderabad. Covered area is 1576.0  Sq-ft. This property belongs to ""Prestige Spring Heights"" .",,1576 sqft,New Property,Unfurnished,2,Poss. by Mar '30,,9346 per sqft,Prestige Spring Heights
"3 BHK Apartment for Sale in Kollur, Outer Ring Road Hyderabad",1.27 Cr,"Though on service road next to ORR, the flat in on the inside which would minimize noise from highway.",1600 sqft,,Resale,Unfurnished,3,,"1 Covered,",7471 per sqft,Hallmark Pinnacle
"3 BHK Apartment for Sale in Uppal, NH 2 2 Hyderabad",1.15 Cr,Multistorey apartment is available for sale in Uppal Bhagayat Layout. It is a good location property. Please contact for more details.,,1530 sqft,Resale,Semi-Furnished,3,,,7516 per sqft,Kasturi Nilayam
"3 BHK Apartment for Sale in Barkatpura, Kachiguda, NH 2 2 Hyderabad",1.45 Cr,residential apartment is available for sale. It is a good location property. Please contact for more details.,1480 sqft,,New Property,Furnished,2,,,9177 per sqft,Barkatpura 3
2 BHK  House for Sale in Meerpet Hyderabad,1 Cr,"A residential house is available for sale. It covered area of 140 sq-yrd, it is a good location. Please contact for more details.",100 sqyrd,,Resale,Unfurnished,1,,,7937 per sqft,
2 BHK Apartment for Sale in Moti Nagar Erragadda Hyderabad,1.30 Cr,"2 BHK, Multistorey Apartment is available for Sale in Moti Nagar Erragadda, Hyderabad for 1.3 Crore(s)",,1177 sqft,Resale,Furnished,2,,123 Covered,11045 per sqft,Brigade Citadel
