Title,Price (INR),Description,Carpet Area,Super Area,Transaction,Furnishing,Bathroom,Possession,Car Parking,Price per Sqft,Society
3 BHK Builder Floor for Sale in Ravindra Nagar Habsiguda Hyderabad,1.40 Cr,"This property is located in St.No.8, Habsiguda, Swathi Tiffens AVR dental clinic lane which is 1KM Only near to NGRI Metro.  Very prime area. This building contains 4 floors and Only One Flat per floor.  The super built area is 1650 sft with two bike and one car parking.  Newly constructed and just a year old building. North facing with Lift facility and 100 Vaastu compliance.This lovely 3 BHK for sale is only 1.4 Crores rupees without any extra brokerage  could be your new home. This North facing home is over 1650 sqft.  is in a convenient location. Situated on the 4th floor this home can comfortably serve your parking place for car needs.::::::::Facilities::::::::The building is provided with necessary facilities to provide a convenient and secure stay. There are covered car parks for residents, providing safety and protection for vehicles. 24hour water supply and 100 power backup facility ensure there is no interruption in comfort for daily use. Security is properly maintained through a specific guard available always, and a lift helps in easy travel across floors, contributing to the convenience of the building as a whole.::::::::Locality::::Situated in the welle stablished Maheswari Nagar, St.No.8, Swathi TiffensAVR dental clinic lane which is 1KM Only near to NGRI Metro, the property has very much connectivity and proximity to day today needs. Situated on the busy Swathi Tiffins on AVR Dental Lane Street No.8, the location has a peaceful residential ambiance with all basic amenities at walking distance.Worldclass schools, hospitals, and shopping facilities such as malls and supermarkets are all located within a 1 km radius, making education, medical care, and daily necessities readily accessible. Public transport is easily accessible, with easy connectivity to buses and autos. The NGRI Metro Station is merely 1 km away, providing easy access to important areas of Hyderabad. Banks and ATMs are also nearby, further enhancing the convenience of everyday living.",1400 sqft,,Resale,Furnished,3,,1 Covered,8485 per sqft,
"3 BHK Apartment for Sale in Tellapur, Outer Ring Road Hyderabad",1.26 Cr,"Step into your dream home with this exquisite 3 BHK flat for sale in Muppas Melody, Tellapur, Hyderabad. Located in a thriving neighborhood, this well-designed residence offers a comfortable lifestyle with easy access to essential amenities and transport links.::::::::::::Property Specifications::::::::::::Spanning an impressive 1400 sq ft, this gorgeous 3 BHK flat is perched on the 10th floor of a modern 30-story building. Step inside to discover elegant vitrified tile flooring that adds a touch of sophistication to each living space, while the west-facing layout ensures a Vaastu-compliant environment brimming with positive energy-what a perfect way to enhance your daily life!::::::::::::Offered unfurnished, this flat is a blank canvas eagerly awaiting your personal touch. As you enter, you are greeted by an elegant living cum dining area, thoughtfully designed for both relaxation and social gatherings. The flat features three generously sized bedrooms, each with the potential to reflect your unique style and preferences, ensuring comfort and privacy for everyone.::::::::::::And here's the best part! With two Western-style bathrooms-one attached and one common-both equipped with geyser points, your morning routines will transform into a seamless experience.::::::::::::Imagine enjoying a cup of coffee on your lovely balcony, attached to the living room, overlooking the road-a perfect spot to unwind and soak in the surroundings. Additionally, the spacious kitchen, equipped with a platform, sink, and attached utility area, is a dream for culinary enthusiasts, providing ample space and convenience for your culinary adventures.::::::::::::Facilities::::::::::::This property offers one covered parking space, a reliable water supply from both borewell and corporation sources, and 100% power backup for uninterrupted living. Security is ensured with a dedicated security guard and CCTV installations. The building is equipped with four lifts, enhancing convenience for residents.::::::::::::Residents can enjoy a host of amenities including a clubhouse, swimming pool, gymnasium, banquet hall, jogging and strolling track, multipurpose hall, aerobics room, indoor games room, indoor squash and badminton courts, kids' play pool with water slides, meditation area, cycling and jogging track, volleyball court, half basketball court, and cricket net practice area, providing a resort-like living experience.::::::::::::Locality::::::::::::Conveniently located in Muppas Melody, this flat is within a 3 km radius of schools and hospitals, ensuring all essential services are close by. Malls and supermarkets are also nearby, making shopping and daily errands easy. Public transport options, including buses and autos, are readily accessible. The Lingampally railway and metro stations are both just 5 km away, enhancing connectivity for commuters. Additionally, banks and ATMs are conveniently located, making managing your finances hassle-free.",1400 sqft,,Resale,Unfurnished,2,,1 Covered,8400 per sqft,Muppas Melody
3 BHK Apartment for Sale in Budwel Hyderabad,1.47 Cr,"Multistorey Apartment for Sale in Budwel, Hyderabad. Covered area is 1576.0  Sq-ft. This property belongs to ""Prestige Spring Heights"" .",,1576 sqft,New Property,Unfurnished,2,Poss. by Mar '30,,9346 per sqft,Prestige Spring Heights
3 BHK Apartment for Sale in Nizampet Hyderabad,1.40 Cr,"If you have been on the lookout for a home that is both comfortable and convenient, this 3 BHK flat in Gokuls Bhuvanam, Nizampet is something to consider. Priced to sell in a peaceful and family-oriented neighborhood, this available-for-sale flat is carefully planned to match your lifestyles. The flat is just ideal for families wanting to settle in a good connectivity area of Hyderabad.Property SpecificationsWith a super area of 1645 sq.ft., the flat is located on the 7th floor in a 14-storey tower, providing a quiet environment and a good view from the balcony. The house is also facing north direction and is Vaastu compliant, which is perfect for those who prioritize traditional concepts in home design.The flat has 3 bedrooms and 3 bathrooms2 attached and 1 commonall with western-style fittings. The dining and living area is created as a double space and is perfect for both relaxation and entertaining. A single balcony opens from the living room, providing an open view and decent ventilation. The kitchen is functional and has a utility space, along with piped gas connection for ease of access. Vitrified tiles are used throughout the flooring, complementing the clean finish. FacilitiesThe complex offers basic amenities like 24-hour water supply, security with CCTV cameras, and two lifts. Parking is also covered. Families would like the community facilities like a childrens play area, a well-fitted gym, a swimming pool and a clubhouse for social events.LocalityRang Restaurant is a popular local landmark and all the necessary services are within walking distance. Schools and hospitals are only 200 metres away and supermarkets are merely 300 metres away. Banks and ATMs are also nearby.Various public transport facilities are easily available. The metro station is only 500 metres from the building, providing easy access to the rest of Hyderabad.",1521 sqft,,New Property,Unfurnished,3,,,8358 per sqft,Gokuls Bhuvanam
3 BHK Builder Floor for Sale in golden stone Hyderabad,1.05 Cr,golden homes golden stone,1650 sqft,,New Property,Unfurnished,3,Poss. by Aug '25,1 Covered,6400 per sqft,
3 BHK Villa for Sale in Ramachandrapuram Hyderabad,1.30 Cr,"Villa is available for sale. It covered area of 1332 sq-ft, it is a good location property. Please contact for more details.",1330 sqft,,Resale,Unfurnished,3,,,8667 per sqft,
3 BHK Apartment for Sale in Serilingampalle M Hyderabad,1.35 Cr,Multistorey apartment is available for sale. It is a good location property. Please contact for more details.,,1710 sqft,Resale,Semi-Furnished,3,,,7895 per sqft,Tejasrees RK Desires
2 BHK Apartment for Sale in Shaikpet Hyderabad,1.15 Cr,,1050 sqft,,Resale,Furnished,2,,,8949 per sqft,Aditya Empress Heights
3 BHK Apartment for Sale in Osman Nagar Hyderabad,1.15 Cr,Multistorey apartment is available for sale. It is a good location property. Please contact for more details.,1150 sqft,,Resale,Unfurnished,3,,,7278 per sqft,Qualitas Nestilo
Plot/Land for Sale in Gagillapur Hyderabad,1.50 Cr,Prime facilities are easily accessible from this place with Canara Bank 5 km . Other key neighbourhood are Zila Parishad High School 8 km .,,,Resale,,,,,3458 per sqft,
"Plot/Land for Sale in Patighanpur, Outer Ring Road Hyderabad",1.05 Cr,"Whether for immediate construction or future appreciation, this property is a rare find in Hyderabad’s evolving real estate landscape. Own a prime residential plot in Patighanpur, Hyderabad, perfect for constructing your dream home or securing a high-growth investment. With high appreciation potential and excellent connectivity, this Plot available for sale in Patighanpur, Hyderabad is the perfect time to invest in your future. ::::::Property Specifications::::::Set amidst the rapidly developing locality of Patighanpur, Hyderabad, this HMDA-approved plot presents an exceptional opportunity for those looking to build their dream home or make a lucrative investment. Spanning 300 square yards of the plot area, this well-demarcated plot comes with sturdy boundary walls, promising safety from animals and trespassers. Moreover, this plot is located within a gated colony, providing a safe and peaceful environment for residents. ::::::This west-facing plot makes it a sought-after choice for homebuyers for permits for G+2 construction, offering ample space for a spacious villa or a multi-storey residence. The road facing the plot is a generous 30 feet wide, providing seamless access and ease of mobility. Situated just 1 km from the main road, this plot enjoys proximity to nearby constructions, reflecting the area's rapid urbanization and growth.::::::Facilities ::::::This plot is equipped with all the essential amenities required for comfortable living. Water supply, electricity, and a well-maintained drainage system are readily available, ensuring a hassle-free construction process and future habitation. The gated community provides a secure environment, making it a perfect choice for families seeking a peaceful yet well-connected neighbourhood.::::::Locality ::::::Strategically positioned near Acer Fuel Station, this plot enjoys excellent connectivity to essential services and everyday conveniences. Some of the prominent schools and well-known hospitals are in the 1km range which is an added benefit. Additionally, several supermarkets and shopping centers are located within a 1 km radius, offering unparalleled ease of access.::::::The major means of roadways such as cabs, taxis, buses and auto-rickshaws, are readily available, ensuring seamless connectivity to other parts of Hyderabad. Additionally, the presence of a nearby highway further enhances accessibility, making daily commutes effortless.::",,,Resale,,,,,3889 per sqft,
Plot/Land for Sale in cheriyal  village Hyderabad,1.15 Cr,,,,Resale,,,,,3667 per sqft,
4 BHK  House for Sale in Dammaiguda Hyderabad,1.35 Cr,,150 sqyrd,,Resale,Unfurnished,4,,,11250 per sqft,
"3 BHK Apartment for Sale in Kollur, Outer Ring Road Hyderabad",1.09 Cr,"Multistorey Apartment for Sale in Kollur, Hyderabad. Covered area is 1820.0  Sq-ft. This property belongs to ""Signature Altius"" .",,1820 sqft,New Property,Unfurnished,3,,,5989 per sqft,Signature Altius
Plot/Land for Sale in Shankarpalle Hyderabad,1.47 Cr,"Residential Plot for Sale in Shankarpalle, Hyderabad. Covered area is 600.0  Sq-ft. This property belongs to ""VIVANTA GREEN MEADOWS"" .",,,New Property,,,,,2733 per sqft,VIVANTA GREEN MEADOWS
Plot/Land for Sale in Ameenpur Hyderabad,1.40 Cr,,,,New Property,,,,,864 per sqft,
3 BHK Apartment for Sale in Patancheruvu Hyderabad,1.10 Cr,Planning to sell my 3bhk 1828 sft. Flat in gated community beside patancheru bus stand and on the mumbai highway main road.I have an immediate requirement to sell my flat for some urgent commitment. So who ever interested please grab this opportunity.,,1828 sqft,Resale,Unfurnished,3,Poss. by Dec '27,,6018 per sqft,
"3 BHK Apartment for Sale in Miyapur, NH 9 Hyderabad",1.29 Cr,"With 200+ world-class amenities and 1 lakh sq.ft. clubhouse spaces, Sky Habitat is raising not just floors but expectations. ::::::::This is not just the city’s newest skyline, it’s its most aspirational one.",,1509 sqft,New Property,Unfurnished,3,Poss. by Dec '26,1 Covered,8567 per sqft,Urbanrise Sky Habitat
6 BHK  House for Sale in Santosh Nagar Hyderabad,1.20 Cr,"Offering a stunning 6 BHK residential home for sale in the serene and well-connected area of Santosh Nagar, Hyderabad. This large and well-planned property provides a perfect living space for big families, with comfort, style, and convenience.Property SpecificationsThis large 6 BHK home in Santosh Nagar, Hyderabad, is laid out over four floors and provides generous space for a big family. The house has a super area of 984 sqft and a carpet area of 1000 sqft, giving generous living space all over. There is one room with an attached western-style bathroom on the ground floor, equipped with a geyser point. A regular kitchen and an external staircase lead to the floors above.There are three bedrooms, two bathrooms an attached one and a common one, both having geysers on the first floor. There is a regular kitchen, living cum dining area, and an attached balcony on one of the bedrooms, giving a good road view. Just like the first floor, there are three bedrooms and two bathrooms one attached and one common with geysers fitted on the second floor. The ground floor also has a standard kitchen, living cum dining room, and a balcony with one of the bedrooms having a road view.The third floor is similar to the first and second floors with three additional bedrooms, two bathrooms one attached and one shared, and an identical layout of a standard kitchen, living cum dining room, and a balcony with a road view.The house is Vaastu friendly to allow good flow of positive energy. The house also comes with vitrified tile flooring, providing a chic and modern appearance. Piped gas connection and utility space linked to the kitchen provide greater convenience in day-to-day living. The west-facing house receives ample natural light. This un-furnished house is an ideal blank canvas where you can plan and make it your own according to your choice and taste.FacilitiesThe property provides a variety of necessary facilities to make it convenient and secure. It has covered parking, giving your vehicles protection. There is a 24-hour water supply from both borewell and corporation sources, making access uninterrupted. Security is taken care of with an arrangement for a security guard, and CCTVs are installed, giving added protection through enhanced surveillance.LocalityThe building is situated in a well-settled and convenient area of Santosh Nagar, Hyderabad. One of the major landmarks, Golden Jubilee High School, is in the vicinity, which makes it suitable for families with school-going children. Owasi Hospital is at a distance of just 1.5 km, providing easy access to healthcare facilities. Shopping malls and supermarkets are at walking distance, giving easy access to shopping and everyday essentials. Public transportation is readily available, with buses and autos just 200 meters from the property, providing great accessibility to other areas of the city. Banks and ATMs are also within walking distance, providing easy finance services.",1000 sqft,,New Property,Unfurnished,5,,,12195 per sqft,
3 BHK Apartment for Sale in Bachupally Hyderabad,1.29 Cr,"Step into modern living with this newly constructed 3 BHK flat for sale in Bachupally, Hyderabad, perfectly situated on the 6th floor of a 10-floor building. This east-facing, Vaastu-compliant apartment offers a spacious super area of 1760 sqft and comes unfurnished, providing a versatile canvas to create your dream home.Property specifications and facilitiesThe flat features 3 bedrooms, each with attached western-style bathrooms, a separate living and dining area, and a normal kitchen equipped with a piped gas connection. Enjoy fresh air and scenic views from the three balconiesone attached to the hall, one to a bedroom, and one to the kitchenoverlooking a serene park and swimming pool.The interiors are enhanced with elegant vitrified flooring, while practical amenities include covered parking, 24-hour water supply, 100 power backup, security guard presence, CCTV surveillance, and two lifts for convenience and safety.LocalityLocated on the bustling 100 ft main road beside Reliance Smart, this property offers excellent connectivity and access to essential services. Schools, hospitals, malls, supermarkets, banks, and ATMs are all within 1 km, making daily errands effortless. Public transport options are nearby, and the railway station is just 5 km away, ensuring smooth commutes across Hyderabad.",1621 sqft,,Resale,Unfurnished,3,,,7386 per sqft,Ark Samyak
Plot/Land for Sale in Turkayamjal Hyderabad,1.20 Cr,"Property Details:::::A premium residential plot is available for sale in the rapidly developing locality of Turkayamjal, Hyderabad. Spanning a land area of 200 square yards, this plot is ideally situated with a wide road frontage of 54 yards, ensuring excellent accessibility and visibility. The location offers a perfect blend of urban connectivity and peaceful surroundings, making it highly suitable for both residential construction and long-term investment. Priced at ?1.20 Crore, this property presents a valuable opportunity for discerning buyers seeking to invest in one of Hyderabad’s emerging real estate corridors. All essential amenities and infrastructure are within close proximity, further enhancing the appeal of this offering.::::Property specifications:::::The plot permits the construction of a single floor and features one open side, providing privacy while maintaining accessibility. It is strategically located just 150 meters from the main road, ensuring convenient connectivity. The surrounding area is well-developed with ongoing and completed residential constructions, contributing to a thriving neighborhood. Notably, Lords School is situated merely 50 meters away, making the location ideal for families with school-going children. With essential infrastructure and educational institutions in close proximity, this plot offers a balanced blend of convenience and tranquility, making it a sound investment opportunity.::::Facilities:::::The plot is fully equipped with essential civic amenities to support comfortable living and construction. A reliable water supply is available, ensuring consistent access to clean water. Additionally, the property is well-connected to the electricity grid, providing uninterrupted power. Proper drainage and seepage systems are also in place, promoting hygienic conditions and minimizing the risk of waterlogging or structural damage. These facilities enhance the overall value and readiness of the plot for immediate construction or future development.::::Locality:::::The plot enjoys a highly advantageous location with seamless access to a wide range of essential services and amenities. Several reputed hospitals are situated within a 200-meter radius, ensuring prompt medical assistance when required. Additionally, malls and supermarkets are also located within the same range, providing residents with convenient options for shopping, dining, and daily essentials. The area is well-served by public transportation, with bus stops and other transit options available just 200 meters away, offering excellent connectivity to various parts of the city. Furthermore, banks and ATMs are in close proximity, facilitating easy access to financial services. This well-connected and amenity-rich environment makes the plot a highly desirable option for both residential use and investment purposes.::::::::::::::::::",,,Resale,,,,,6667 per sqft,
"2 BHK Apartment for Sale in Pragathi Nagar, Kukatpally Hyderabad",1.07 Cr,"Own a stylish and cozy home with this 2 BHK apartment for sale in RKs Oxygen Homes, Aero Nagar, Bachupally, Hyderabad. Part of a well-planned residential complex, this apartment provides an ideal mix of convenience, connectivity, and tranquil living.Property SpecificationsPositioned on the 9th floor of the 10-storey building, the apartment covers a super area of 1260 sq. ft. and completely equipped with brand new, elegant furniture, including a special extra door that brings the entrance both charm and safety. There are two large bedrooms in the flat, one with its own bathroom and the other with access to a shared bathroom. Both bathrooms are western and fitted with geysers for extra convenience. The dining area and living space are comfortably divided, maximizing the spacious nature and movement of the house. One balcony linked to the hall provides an impressive forest view, ideal to relax and soak in nature.The modular kitchen features a chimney and has a piped gas connection included, ideal for everyday cooking. A utility area linked to it provides functionality and additional space for domestic duties. The vitrified flooring across the apartment provides a neat and shiny appearance, and is low on maintenance. The West-facing flat is Vaastu friendly, bringing good energy and natural light. The 9th floor elevation not only offers a better view but also good ventilation and lesser noise.FacilitiesResidents have the facility of covered parking for parking their vehicles safely and conveniently. 24-hour water supply and 100 power backup facilitate uninterrupted services day and night. The complex is well-protected with a personal security guard and CCTV monitoring around the compound. With 5 to 6 lifts available in the complex, including a lift adjacent to the flat, residents have easy access to their home, making daily mobility convenient.LocalitySituated in the proximity of the Pragathi Nagar Command area, RKs Oxygen Homes in Aero Nagar, Bachupally has a good residential location with very good access to basic facilities. The area is well-developed with a fine blend of quiet living and city convenience. It is well-connected to good schools such as Orchid International School located just 5 to 6 minutes away from here, an excellent location for families. Hospitals, shopping malls, and grocery stores are all located within a radius of 1 km so that medical care and everyday needs are never far away. Public transport is readily accessible, and banks and ATM machines are easily found nearby. The nearest metro station is within a 20-minute reach, adding to connectivity within the city. Besides, a forthcoming flyover that is just 5 minutes away from here guarantees better travel time and smoother road connectivity in the coming times.",1161 sqft,,Resale,Furnished,2,,,8492 per sqft,RKs Oxygen Homes
